{
  "schema_version": "motion-os.golden-output-fidelity-manifest/v2",
  "program_id": "screenrecording_20260826-golden-output-fidelity-v2",
  "promotion_rule": "All required observable-output claims in all nine dimensions must independently QUALIFY. Original authoring provenance is queryable but non-gating.",
  "scenes": [
    {"scene_id":"S04_CIENTIFICAMENTE","pr":96,"head_sha":"8ec35a259399d7b196b40627d782315a019e65e2"},
    {"scene_id":"S11_UI_LIST","pr":107,"head_sha":"988e91893cb498f720b9c2656b3d6d85f2d56300"},
    {"scene_id":"S14_AUDIO_VISUAL_TEXTO","pr":124,"head_sha":"12592bd8f8149767fafcb0ad0aa6036250ce540c"},
    {"scene_id":"S16_FACTOR_X","pr":125,"head_sha":"8e6fcb79d0d7958c0f023f128297059c97a7e674"}
  ],
  "evidence": [
    {"evidence_id":"S04_EXACT_ARTIFACT","scene_id":"S04_CIENTIFICAMENTE","kind":"workflow_artifact","authority":"PHYSICALLY_MEASURED","revision":"8ec35a259399d7b196b40627d782315a019e65e2","uri":"github:artifact:9802271767","digest":"sha256:338318f80fb52e5567f2c6efe2b2cdb6ec0d704e28c30317e08cff67b4604bdf"},
    {"evidence_id":"S04_OUTPUT_EQUIV","scene_id":"S04_CIENTIFICAMENTE","kind":"output_equivalence_proof","authority":"PHYSICALLY_MEASURED","revision":"8ec35a259399d7b196b40627d782315a019e65e2","uri":"github:pr:96","notes":"PR #96 records exact-head payload equivalence to the previously source-qualified renderer output."},
    {"evidence_id":"S04_SOURCE_QUAL","scene_id":"S04_CIENTIFICAMENTE","kind":"source_bound_qualification","authority":"PHYSICALLY_MEASURED","revision":"0790a005f391327b731464d269e42864c64ea4cb","uri":"github:file:golden/s04/fidelity/s04_fidelity_current.json","equivalence_proof_id":"S04_OUTPUT_EQUIV"},

    {"evidence_id":"S11_EXACT_ARTIFACT","scene_id":"S11_UI_LIST","kind":"workflow_artifact","authority":"PHYSICALLY_MEASURED","revision":"988e91893cb498f720b9c2656b3d6d85f2d56300","uri":"github:artifact:9802633943","digest":"sha256:01c0823bd1e4f35b8ce2d47c11959fccf89f8d69098f3561ca596e81299ad874"},
    {"evidence_id":"S11_OUTPUT_EQUIV","scene_id":"S11_UI_LIST","kind":"output_equivalence_proof","authority":"PHYSICALLY_MEASURED","revision":"988e91893cb498f720b9c2656b3d6d85f2d56300","uri":"github:file:golden/aggregate_9d/cross_scene_output_equivalence.json","notes":"141/141 internal artifact files byte-identical."},
    {"evidence_id":"S11_SOURCE_QUAL","scene_id":"S11_UI_LIST","kind":"source_bound_qualification","authority":"PHYSICALLY_MEASURED","revision":"7cfe7bbd272b2adb65b4bea4792a67e4c91a5f7a","uri":"github:file:golden/s11/fidelity/s11_postrepair_qualification.json","equivalence_proof_id":"S11_OUTPUT_EQUIV"},

    {"evidence_id":"S14_EXACT_ARTIFACT","scene_id":"S14_AUDIO_VISUAL_TEXTO","kind":"workflow_artifact","authority":"PHYSICALLY_MEASURED","revision":"12592bd8f8149767fafcb0ad0aa6036250ce540c","uri":"github:artifact:9781727915","digest":"sha256:42cef4cb4c2ff26f0c8fffbb87dcf1933e9406049a29d7d74e71ba5519733df8"},
    {"evidence_id":"S14_OUTPUT_EQUIV","scene_id":"S14_AUDIO_VISUAL_TEXTO","kind":"output_equivalence_proof","authority":"PHYSICALLY_MEASURED","revision":"12592bd8f8149767fafcb0ad0aa6036250ce540c","uri":"github:file:golden/aggregate_9d/cross_scene_output_equivalence.json","notes":"105/105 internal artifact files byte-identical."},
    {"evidence_id":"S14_VISIBLE_QUAL","scene_id":"S14_AUDIO_VISUAL_TEXTO","kind":"source_bound_qualification","authority":"PHYSICALLY_MEASURED","revision":"1ec6a2e561b2e7f67569242dbd3fbaebc724defa","uri":"github:file:golden/s14/fidelity/s14_fidelity_1ec6.json","equivalence_proof_id":"S14_OUTPUT_EQUIV"},
    {"evidence_id":"S14_AUDIO_QUAL","scene_id":"S14_AUDIO_VISUAL_TEXTO","kind":"audio_timing_qualification","authority":"PHYSICALLY_MEASURED","revision":"1ec6a2e561b2e7f67569242dbd3fbaebc724defa","uri":"github:file:golden/s14/fidelity/s14_audio_qualification_1ec6.json","equivalence_proof_id":"S14_OUTPUT_EQUIV"},

    {"evidence_id":"S16_EXACT_ARTIFACT","scene_id":"S16_FACTOR_X","kind":"workflow_artifact","authority":"PHYSICALLY_MEASURED","revision":"8e6fcb79d0d7958c0f023f128297059c97a7e674","uri":"github:artifact:9801246395","digest":"sha256:d4c46db77186ecacde60568b5530c36e19f24dceabaf97e7dbad5da1a51b4ceb"},
    {"evidence_id":"S16_EXACT_REVERIFY","scene_id":"S16_FACTOR_X","kind":"source_bound_exact_head_reverification","authority":"PHYSICALLY_MEASURED","revision":"8e6fcb79d0d7958c0f023f128297059c97a7e674","uri":"drive:1hEoRqLYVk3rMUrlLKH1VS174JsO8Tj-O","notes":"Exact-head layout proxy and audio-timing remeasurement."},
    {"evidence_id":"S16_OUTPUT_EQUIV","scene_id":"S16_FACTOR_X","kind":"output_equivalence_proof","authority":"PHYSICALLY_MEASURED","revision":"8e6fcb79d0d7958c0f023f128297059c97a7e674","uri":"drive:1hEoRqLYVk3rMUrlLKH1VS174JsO8Tj-O"},
    {"evidence_id":"S16_PROXY_REVIEW","scene_id":"S16_FACTOR_X","kind":"advisory_source_vs_render_review","authority":"PHYSICALLY_MEASURED","revision":"e34b38061e2ad1d322238a011f5c6b9660b883ee","uri":"github:file:golden/s16/fidelity/s16_production_proxy_review_e34b.json","equivalence_proof_id":"S16_OUTPUT_EQUIV"},

    {"evidence_id":"PROGRAM_RETENTION_V3","scene_id":"PROGRAM","kind":"full_video_observable_retention_measurement","authority":"PHYSICALLY_MEASURED","uri":"github:file:golden/aggregate_9d/retention_grammar_summary_v3.json","digest":"sha256:442f784a66dab57678b8dcc25fc2018fa433ec4fa0d5de99249a9633dc29364e","notes":"Full 835-frame physical visual/audio signal measurement; semantic labels are bounded separately and editor intent is not claimed."}
  ],
  "output_claims": [
    {"claim_id":"S04_TIMING","scene_id":"S04_CIENTIFICAMENTE","dimension":"temporal","semantic_target":"rendered_caption_and_audio_timing","claim_kind":"rendered_timing","required":true,"status":"QUALIFIED","authority":"PHYSICALLY_MEASURED","evidence_ids":["S04_SOURCE_QUAL","S04_EXACT_ARTIFACT"],"scope":"declared P0/P1 setup/hero/tail timing and major audio onset","severity_if_unqualified":"P1"},
    {"claim_id":"S11_TIMING","scene_id":"S11_UI_LIST","dimension":"temporal","semantic_target":"rendered_ui_and_row_timing","claim_kind":"rendered_timing","required":true,"status":"QUALIFIED","authority":"PHYSICALLY_MEASURED","evidence_ids":["S11_SOURCE_QUAL","S11_EXACT_ARTIFACT"],"scope":"pill, boxed word and row timing","severity_if_unqualified":"P1"},
    {"claim_id":"S14_TIMING","scene_id":"S14_AUDIO_VISUAL_TEXTO","dimension":"temporal","semantic_target":"rendered_state_card_heading_annotation_timing","claim_kind":"rendered_timing","required":true,"status":"QUALIFIED","authority":"PHYSICALLY_MEASURED","evidence_ids":["S14_VISIBLE_QUAL","S14_EXACT_ARTIFACT"],"scope":"three-state visible timing","severity_if_unqualified":"P1"},
    {"claim_id":"S16_TIMING","scene_id":"S16_FACTOR_X","dimension":"temporal","semantic_target":"rendered_foreground_payoff_timing","claim_kind":"rendered_timing","required":true,"status":"QUALIFIED","authority":"PHYSICALLY_MEASURED","evidence_ids":["S16_EXACT_REVERIFY","S16_EXACT_ARTIFACT"],"scope":"column/question/Factor-X layout timing and calm hold","severity_if_unqualified":"P1"},

    {"claim_id":"S04_KINEMATICS","scene_id":"S04_CIENTIFICAMENTE","dimension":"motion","semantic_target":"rendered_caption_and_reframe_trajectory_velocity_settle","claim_kind":"rendered_kinematics","required":true,"status":"PARTIAL","authority":"PHYSICALLY_MEASURED","evidence_ids":["S04_SOURCE_QUAL"],"scope":"visible layout/timing measured but complete per-frame trajectory/velocity/settle field not yet qualified","severity_if_unqualified":"P1","blocked_reason":"Need source-bound per-frame kinematics independent of original authoring method."},
    {"claim_id":"S11_KINEMATICS","scene_id":"S11_UI_LIST","dimension":"motion","semantic_target":"rendered_stagger_and_micro_motion_kinematics","claim_kind":"rendered_kinematics","required":true,"status":"PARTIAL","authority":"PHYSICALLY_MEASURED","evidence_ids":["S11_SOURCE_QUAL"],"scope":"entry boxes/timing qualified; per-frame velocity/settle grammar incomplete","severity_if_unqualified":"P1","blocked_reason":"Need complete per-frame visible kinematics for staggered UI entities."},
    {"claim_id":"S14_KINEMATICS","scene_id":"S14_AUDIO_VISUAL_TEXTO","dimension":"motion","semantic_target":"rendered_carousel_card_heading_annotation_trajectories","claim_kind":"rendered_kinematics","required":true,"status":"QUALIFIED","authority":"PHYSICALLY_MEASURED","evidence_ids":["S14_VISIBLE_QUAL"],"scope":"target-isolated per-frame visible trajectories qualified","severity_if_unqualified":"P1"},
    {"claim_id":"S16_KINEMATICS","scene_id":"S16_FACTOR_X","dimension":"motion","semantic_target":"rendered_foreground_screen_space_trajectories","claim_kind":"rendered_kinematics","required":true,"status":"QUALIFIED","authority":"PHYSICALLY_MEASURED","evidence_ids":["S16_EXACT_REVERIFY"],"scope":"full-frame column/question/Factor-X layout trajectories; alpha handled separately in FX","severity_if_unqualified":"P1"},

    {"claim_id":"S04_CAMERA_FIELD","scene_id":"S04_CIENTIFICAMENTE","dimension":"camera","semantic_target":"rendered_global_local_motion_field_and_parallax","claim_kind":"rendered_camera_motion_field","required":true,"status":"NOT_MEASURED","authority":"UNKNOWN","evidence_ids":[],"scope":"output field can be measured without identifying original camera/crop implementation","severity_if_unqualified":"P1","blocked_reason":"Source-bound camera/global-vs-local motion field has not yet been independently measured."},
    {"claim_id":"S16_CAMERA_FIELD","scene_id":"S16_FACTOR_X","dimension":"camera","semantic_target":"rendered_static_field_then_late_common_reflow","claim_kind":"rendered_camera_motion_field","required":true,"status":"QUALIFIED","authority":"PHYSICALLY_MEASURED","evidence_ids":["S16_EXACT_REVERIFY"],"scope":"static editorial framing through local86 plus measured common late reflow; causal authoring identity not required","severity_if_unqualified":"P1"},